{
  "schema": "changerail.maintenance-proposal-decision.v1",
  "proposal_id": "contradiction-annotation",
  "finding_fingerprint": "sha256:4444444444444444444444444444444444444444444444444444444444444444",
  "transformation_class": "contradiction-annotation",
  "decision": "rejected",
  "decided_at": "2026-08-09T00:50:00Z",
  "evidence_refs": [
    {
      "kind": "model_annotation",
      "key": "boundary",
      "value": "evidence_only"
    },
    {
      "kind": "fixture",
      "key": "path",
      "value": "fixtures/repository-knowledge/quality/report-latest.json"
    }
  ]
}
