{
  "schema": "changerail.maintenance-proposal-decision.v1",
  "proposal_id": "proposal-accepted",
  "finding_fingerprint": "sha256:2222222222222222222222222222222222222222222222222222222222222222",
  "transformation_class": "docs-update",
  "decision": "accepted",
  "decided_at": "2026-08-09T00:40:00Z",
  "evidence_refs": [
    {
      "kind": "proposal",
      "key": "path",
      "value": ".runtime/changerail/maintenance/proposals/proposal-accepted.json"
    }
  ]
}
